3rdparty/vllm/model_executor/layers/quantization/configs/awq_gemm_N=7168,K=2048,device_name=BW200,dtype=w4a16,group_size=64.json
{
    "1": {
        "BLOCK_SIZE_M": 32,
        "BLOCK_SIZE_N": 64,
        "BLOCK_SIZE_K": 64,
        "SCHEDULER": 0,
        "SPLITK": 8,
        "num_warps": 4,
        "num_ctas": 1,
        "num_stages": 1
    },
    "2": {
        "BLOCK_SIZE_M": 32,
        "BLOCK_SIZE_N": 64,
        "BLOCK_SIZE_K": 64,
        "SCHEDULER": 0,
        "SPLITK": 8,
        "num_warps": 4,
        "num_ctas": 1,
        "num_stages": 1
    },
    "3": {
        "BLOCK_SIZE_M": 32,
        "BLOCK_SIZE_N": 64,
        "BLOCK_SIZE_K": 64,
        "SCHEDULER": 0,
        "SPLITK": 8,
        "num_warps": 4,
        "num_ctas": 1,
        "num_stages": 1
    },
    "4": {
        "BLOCK_SIZE_M": 32,
        "BLOCK_SIZE_N": 64,
        "BLOCK_SIZE_K": 64,
        "SCHEDULER": 0,
        "SPLITK": 8,
        "num_warps": 4,
        "num_ctas": 1,
        "num_stages": 1
    },
    "5": {
        "BLOCK_SIZE_M": 32,
        "BLOCK_SIZE_N": 64,
        "BLOCK_SIZE_K": 64,
        "SCHEDULER": 0,
        "SPLITK": 8,
        "num_warps": 4,
        "num_ctas": 1,
        "num_stages": 1
    },
    "6": {
        "BLOCK_SIZE_M": 32,
        "BLOCK_SIZE_N": 64,
        "BLOCK_SIZE_K": 64,
        "SCHEDULER": 0,
        "SPLITK": 8,
        "num_warps": 4,
        "num_ctas": 1,
        "num_stages": 1
    },
    "7": {
        "BLOCK_SIZE_M": 32,
        "BLOCK_SIZE_N": 64,
        "BLOCK_SIZE_K": 64,
        "SCHEDULER": 0,
        "SPLITK": 8,
        "num_warps": 4,
        "num_ctas": 1,
        "num_stages": 1
    },
    "8": {
        "BLOCK_SIZE_M": 32,
        "BLOCK_SIZE_N": 64,
        "BLOCK_SIZE_K": 64,
        "SCHEDULER": 0,
        "SPLITK": 8,
        "num_warps": 4,
        "num_ctas": 1,
        "num_stages": 1
    },
    "9": {
        "BLOCK_SIZE_M": 32,
        "BLOCK_SIZE_N": 64,
        "BLOCK_SIZE_K": 64,
        "SCHEDULER": 0,
        "SPLITK": 8,
        "num_warps": 4,
        "num_ctas": 1,
        "num_stages": 1
    },
    "10": {
        "BLOCK_SIZE_M": 32,
        "BLOCK_SIZE_N": 64,
        "BLOCK_SIZE_K": 64,
        "SCHEDULER": 0,
        "SPLITK": 8,
        "num_warps": 4,
        "num_ctas": 1,
        "num_stages": 1
    },
    "11": {
        "BLOCK_SIZE_M": 32,
        "BLOCK_SIZE_N": 64,
        "BLOCK_SIZE_K": 64,
        "SCHEDULER": 0,
        "SPLITK": 8,
        "num_warps": 4,
        "num_ctas": 1,
        "num_stages": 1
    },
    "12": {
        "BLOCK_SIZE_M": 32,
        "BLOCK_SIZE_N": 64,
        "BLOCK_SIZE_K": 64,
        "SCHEDULER": 0,
        "SPLITK": 8,
        "num_warps": 4,
        "num_ctas": 1,
        "num_stages": 1
    },
    "13": {
        "BLOCK_SIZE_M": 32,
        "BLOCK_SIZE_N": 64,
        "BLOCK_SIZE_K": 64,
        "SCHEDULER": 0,
        "SPLITK": 4,
        "num_warps": 4,
        "num_ctas": 1,
        "num_stages": 1
    },
    "14": {
        "BLOCK_SIZE_M": 32,
        "BLOCK_SIZE_N": 64,
        "BLOCK_SIZE_K": 64,
        "SCHEDULER": 0,
        "SPLITK": 4,
        "num_warps": 4,
        "num_ctas": 1,
        "num_stages": 1
    },
    "15": {
        "BLOCK_SIZE_M": 32,
        "BLOCK_SIZE_N": 64,
        "BLOCK_SIZE_K": 64,
        "SCHEDULER": 0,
        "SPLITK": 4,
        "num_warps": 4,
        "num_ctas": 1,
        "num_stages": 1
    },
    "16": {
        "BLOCK_SIZE_M": 32,
        "BLOCK_SIZE_N": 64,
        "BLOCK_SIZE_K": 64,
        "SCHEDULER": 0,
        "SPLITK": 4,
        "num_warps": 4,
        "num_ctas": 1,
        "num_stages": 1
    },
    "17": {
        "BLOCK_SIZE_M": 32,
        "BLOCK_SIZE_N": 64,
        "BLOCK_SIZE_K": 64,
        "SCHEDULER": 0,
        "SPLITK": 4,
        "num_warps": 4,
        "num_ctas": 1,
        "num_stages": 1
    },
    "18": {
        "BLOCK_SIZE_M": 32,
        "BLOCK_SIZE_N": 64,
        "BLOCK_SIZE_K": 64,
        "SCHEDULER": 0,
        "SPLITK": 4,
        "num_warps": 4,
        "num_ctas": 1,
        "num_stages": 1
    },
    "19": {
        "BLOCK_SIZE_M": 32,
        "BLOCK_SIZE_N": 64,
        "BLOCK_SIZE_K": 64,
        "SCHEDULER": 0,
        "SPLITK": 4,
        "num_warps": 4,
        "num_ctas": 1,
        "num_stages": 1
    },
    "20": {
        "BLOCK_SIZE_M": 32,
        "BLOCK_SIZE_N": 64,
        "BLOCK_SIZE_K": 64,
        "SCHEDULER": 0,
        "SPLITK": 4,
        "num_warps": 4,
        "num_ctas": 1,
        "num_stages": 1
    },
    "21": {
        "BLOCK_SIZE_M": 32,
        "BLOCK_SIZE_N": 64,
        "BLOCK_SIZE_K": 64,
        "SCHEDULER": 0,
        "SPLITK": 4,
        "num_warps": 4,
        "num_ctas": 1,
        "num_stages": 1
    },
    "22": {
        "BLOCK_SIZE_M": 32,
        "BLOCK_SIZE_N": 64,
        "BLOCK_SIZE_K": 64,
        "SCHEDULER": 0,
        "SPLITK": 4,
        "num_warps": 4,
        "num_ctas": 1,
        "num_stages": 1
    },
    "23": {
        "BLOCK_SIZE_M": 32,
        "BLOCK_SIZE_N": 64,
        "BLOCK_SIZE_K": 64,
        "SCHEDULER": 0,
        "SPLITK": 4,
        "num_warps": 4,
        "num_ctas": 1,
        "num_stages": 1
    },
    "24": {
        "BLOCK_SIZE_M": 32,
        "BLOCK_SIZE_N": 64,
        "BLOCK_SIZE_K": 64,
        "SCHEDULER": 0,
        "SPLITK": 4,
        "num_warps": 4,
        "num_ctas": 1,
        "num_stages": 1
    },
    "25": {
        "BLOCK_SIZE_M": 32,
        "BLOCK_SIZE_N": 64,
        "BLOCK_SIZE_K": 64,
        "SCHEDULER": 0,
        "SPLITK": 4,
        "num_warps": 4,
        "num_ctas": 1,
        "num_stages": 1
    },
    "26": {
        "BLOCK_SIZE_M": 32,
        "BLOCK_SIZE_N": 64,
        "BLOCK_SIZE_K": 64,
        "SCHEDULER": 0,
        "SPLITK": 4,
        "num_warps": 4,
        "num_ctas": 1,
        "num_stages": 1
    },
    "27": {
        "BLOCK_SIZE_M": 32,
        "BLOCK_SIZE_N": 64,
        "BLOCK_SIZE_K": 64,
        "SCHEDULER": 0,
        "SPLITK": 4,
        "num_warps": 4,
        "num_ctas": 1,
        "num_stages": 1
    },
    "28": {
        "BLOCK_SIZE_M": 32,
        "BLOCK_SIZE_N": 64,
        "BLOCK_SIZE_K": 64,
        "SCHEDULER": 0,
        "SPLITK": 4,
        "num_warps": 4,
        "num_ctas": 1,
        "num_stages": 1
    },
    "29": {
        "BLOCK_SIZE_M": 32,
        "BLOCK_SIZE_N": 64,
        "BLOCK_SIZE_K": 64,
        "SCHEDULER": 0,
        "SPLITK": 4,
        "num_warps": 4,
        "num_ctas": 1,
        "num_stages": 1
    },
    "30": {
        "BLOCK_SIZE_M": 32,
        "BLOCK_SIZE_N": 64,
        "BLOCK_SIZE_K": 64,
        "SCHEDULER": 0,
        "SPLITK": 4,
        "num_warps": 4,
        "num_ctas": 1,
        "num_stages": 1
    },
    "31": {
        "BLOCK_SIZE_M": 32,
        "BLOCK_SIZE_N": 64,
        "BLOCK_SIZE_K": 64,
        "SCHEDULER": 0,
        "SPLITK": 4,
        "num_warps": 4,
        "num_ctas": 1,
        "num_stages": 1
    },
    "32": {
        "BLOCK_SIZE_M": 32,
        "BLOCK_SIZE_N": 64,
        "BLOCK_SIZE_K": 64,
        "SCHEDULER": 0,
        "SPLITK": 4,
        "num_warps": 4,
        "num_ctas": 1,
        "num_stages": 1
    },
    "33": {
        "BLOCK_SIZE_M": 64,
        "BLOCK_SIZE_N": 64,
        "BLOCK_SIZE_K": 64,
        "SCHEDULER": 0,
        "SPLITK": 4,
        "num_warps": 4,
        "num_ctas": 1,
        "num_stages": 1
    },
    "34": {
        "BLOCK_SIZE_M": 64,
        "BLOCK_SIZE_N": 64,
        "BLOCK_SIZE_K": 64,
        "SCHEDULER": 0,
        "SPLITK": 4,
        "num_warps": 4,
        "num_ctas": 1,
        "num_stages": 1
    },
    "35": {
        "BLOCK_SIZE_M": 64,
        "BLOCK_SIZE_N": 64,
        "BLOCK_SIZE_K": 64,
        "SCHEDULER": 0,
        "SPLITK": 4,
        "num_warps": 4,
        "num_ctas": 1,
        "num_stages": 1
    },
    "36": {
        "BLOCK_SIZE_M": 64,
        "BLOCK_SIZE_N": 32,
        "BLOCK_SIZE_K": 64,
        "SCHEDULER": 0,
        "SPLITK": 2,
        "num_warps": 4,
        "num_ctas": 1,
        "num_stages": 1
    },
    "37": {
        "BLOCK_SIZE_M": 64,
        "BLOCK_SIZE_N": 32,
        "BLOCK_SIZE_K": 64,
        "SCHEDULER": 0,
        "SPLITK": 2,
        "num_warps": 4,
        "num_ctas": 1,
        "num_stages": 1
    },
    "38": {
        "BLOCK_SIZE_M": 64,
        "BLOCK_SIZE_N": 32,
        "BLOCK_SIZE_K": 64,
        "SCHEDULER": 0,
        "SPLITK": 2,
        "num_warps": 4,
        "num_ctas": 1,
        "num_stages": 1
    },
    "39": {
        "BLOCK_SIZE_M": 64,
        "BLOCK_SIZE_N": 32,
        "BLOCK_SIZE_K": 64,
        "SCHEDULER": 0,
        "SPLITK": 2,
        "num_warps": 4,
        "num_ctas": 1,
        "num_stages": 1
    },
    "40": {
        "BLOCK_SIZE_M": 64,
        "BLOCK_SIZE_N": 32,
        "BLOCK_SIZE_K": 64,
        "SCHEDULER": 0,
        "SPLITK": 2,
        "num_warps": 4,
        "num_ctas": 1,
        "num_stages": 1
    },
    "41": {
        "BLOCK_SIZE_M": 64,
        "BLOCK_SIZE_N": 32,
        "BLOCK_SIZE_K": 64,
        "SCHEDULER": 0,
        "SPLITK": 2,
        "num_warps": 4,
        "num_ctas": 1,
        "num_stages": 1
    },
    "42": {
        "BLOCK_SIZE_M": 64,
        "BLOCK_SIZE_N": 32,
        "BLOCK_SIZE_K": 64,
        "SCHEDULER": 0,
        "SPLITK": 2,
        "num_warps": 4,
        "num_ctas": 1,
        "num_stages": 1
    },
    "43": {
        "BLOCK_SIZE_M": 64,
        "BLOCK_SIZE_N": 32,
        "BLOCK_SIZE_K": 64,
        "SCHEDULER": 0,
        "SPLITK": 2,
        "num_warps": 4,
        "num_ctas": 1,
        "num_stages": 1
    },
    "44": {
        "BLOCK_SIZE_M": 64,
        "BLOCK_SIZE_N": 32,
        "BLOCK_SIZE_K": 64,
        "SCHEDULER": 0,
        "SPLITK": 2,
        "num_warps": 4,
        "num_ctas": 1,
        "num_stages": 1
    },
    "45": {
        "BLOCK_SIZE_M": 64,
        "BLOCK_SIZE_N": 32,
        "BLOCK_SIZE_K": 64,
        "SCHEDULER": 0,
        "SPLITK": 2,
        "num_warps": 4,
        "num_ctas": 1,
        "num_stages": 1
    },
    "46": {
        "BLOCK_SIZE_M": 64,
        "BLOCK_SIZE_N": 32,
        "BLOCK_SIZE_K": 64,
        "SCHEDULER": 0,
        "SPLITK": 2,
        "num_warps": 4,
        "num_ctas": 1,
        "num_stages": 1
    },
    "47": {
        "BLOCK_SIZE_M": 64,
        "BLOCK_SIZE_N": 32,
        "BLOCK_SIZE_K": 64,
        "SCHEDULER": 0,
        "SPLITK": 2,
        "num_warps": 4,
        "num_ctas": 1,
        "num_stages": 1
    },
    "48": {
        "BLOCK_SIZE_M": 64,
        "BLOCK_SIZE_N": 32,
        "BLOCK_SIZE_K": 64,
        "SCHEDULER": 0,
        "SPLITK": 2,
        "num_warps": 4,
        "num_ctas": 1,
        "num_stages": 1
    },
    "49": {
        "BLOCK_SIZE_M": 64,
        "BLOCK_SIZE_N": 32,
        "BLOCK_SIZE_K": 64,
        "SCHEDULER": 0,
        "SPLITK": 2,
        "num_warps": 4,
        "num_ctas": 1,
        "num_stages": 1
    },
    "50": {
        "BLOCK_SIZE_M": 64,
        "BLOCK_SIZE_N": 32,
        "BLOCK_SIZE_K": 64,
        "SCHEDULER": 0,
        "SPLITK": 2,
        "num_warps": 4,
        "num_ctas": 1,
        "num_stages": 1
    },
    "51": {
        "BLOCK_SIZE_M": 64,
        "BLOCK_SIZE_N": 32,
        "BLOCK_SIZE_K": 64,
        "SCHEDULER": 0,
        "SPLITK": 2,
        "num_warps": 4,
        "num_ctas": 1,
        "num_stages": 1
    },
    "52": {
        "BLOCK_SIZE_M": 64,
        "BLOCK_SIZE_N": 32,
        "BLOCK_SIZE_K": 64,
        "SCHEDULER": 0,
        "SPLITK": 2,
        "num_warps": 4,
        "num_ctas": 1,
        "num_stages": 1
    },
    "53": {
        "BLOCK_SIZE_M": 64,
        "BLOCK_SIZE_N": 32,
        "BLOCK_SIZE_K": 64,
        "SCHEDULER": 0,
        "SPLITK": 2,
        "num_warps": 4,
        "num_ctas": 1,
        "num_stages": 1
    },
    "54": {
        "BLOCK_SIZE_M": 64,
        "BLOCK_SIZE_N": 32,
        "BLOCK_SIZE_K": 64,
        "SCHEDULER": 0,
        "SPLITK": 2,
        "num_warps": 4,
        "num_ctas": 1,
        "num_stages": 1
    },
    "55": {
        "BLOCK_SIZE_M": 64,
        "BLOCK_SIZE_N": 32,
        "BLOCK_SIZE_K": 64,
        "SCHEDULER": 0,
        "SPLITK": 2,
        "num_warps": 4,
        "num_ctas": 1,
        "num_stages": 1
    },
    "56": {
        "BLOCK_SIZE_M": 64,
        "BLOCK_SIZE_N": 32,
        "BLOCK_SIZE_K": 64,
        "SCHEDULER": 0,
        "SPLITK": 2,
        "num_warps": 4,
        "num_ctas": 1,
        "num_stages": 1
    },
    "57": {
        "BLOCK_SIZE_M": 64,
        "BLOCK_SIZE_N": 32,
        "BLOCK_SIZE_K": 64,
        "SCHEDULER": 0,
        "SPLITK": 2,
        "num_warps": 4,
        "num_ctas": 1,
        "num_stages": 1
    },
    "58": {
        "BLOCK_SIZE_M": 64,
        "BLOCK_SIZE_N": 64,
        "BLOCK_SIZE_K": 64,
        "SCHEDULER": 0,
        "SPLITK": 2,
        "num_warps": 8,
        "num_ctas": 1,
        "num_stages": 2
    },
    "59": {
        "BLOCK_SIZE_M": 64,
        "BLOCK_SIZE_N": 64,
        "BLOCK_SIZE_K": 64,
        "SCHEDULER": 0,
        "SPLITK": 2,
        "num_warps": 8,
        "num_ctas": 1,
        "num_stages": 2
    },
    "60": {
        "BLOCK_SIZE_M": 64,
        "BLOCK_SIZE_N": 64,
        "BLOCK_SIZE_K": 64,
        "SCHEDULER": 0,
        "SPLITK": 2,
        "num_warps": 8,
        "num_ctas": 1,
        "num_stages": 2
    },
    "61": {
        "BLOCK_SIZE_M": 64,
        "BLOCK_SIZE_N": 64,
        "BLOCK_SIZE_K": 64,
        "SCHEDULER": 0,
        "SPLITK": 2,
        "num_warps": 8,
        "num_ctas": 1,
        "num_stages": 2
    },
    "62": {
        "BLOCK_SIZE_M": 64,
        "BLOCK_SIZE_N": 64,
        "BLOCK_SIZE_K": 64,
        "SCHEDULER": 0,
        "SPLITK": 2,
        "num_warps": 8,
        "num_ctas": 1,
        "num_stages": 2
    },
    "63": {
        "BLOCK_SIZE_M": 64,
        "BLOCK_SIZE_N": 64,
        "BLOCK_SIZE_K": 64,
        "SCHEDULER": 0,
        "SPLITK": 2,
        "num_warps": 8,
        "num_ctas": 1,
        "num_stages": 2
    },
    "64": {
        "BLOCK_SIZE_M": 64,
        "BLOCK_SIZE_N": 64,
        "BLOCK_SIZE_K": 64,
        "SCHEDULER": 0,
        "SPLITK": 2,
        "num_warps": 8,
        "num_ctas": 1,
        "num_stages": 2
    },
    "65": {
        "BLOCK_SIZE_M": 128,
        "BLOCK_SIZE_N": 64,
        "BLOCK_SIZE_K": 64,
        "SCHEDULER": 0,
        "SPLITK": 2,
        "num_warps": 4,
        "num_ctas": 1,
        "num_stages": 1
    },
    "66": {
        "BLOCK_SIZE_M": 128,
        "BLOCK_SIZE_N": 64,
        "BLOCK_SIZE_K": 64,
        "SCHEDULER": 0,
        "SPLITK": 2,
        "num_warps": 4,
        "num_ctas": 1,
        "num_stages": 1
    },
    "67": {
        "BLOCK_SIZE_M": 128,
        "BLOCK_SIZE_N": 64,
        "BLOCK_SIZE_K": 64,
        "SCHEDULER": 0,
        "SPLITK": 2,
        "num_warps": 4,
        "num_ctas": 1,
        "num_stages": 1
    },
    "68": {
        "BLOCK_SIZE_M": 128,
        "BLOCK_SIZE_N": 64,
        "BLOCK_SIZE_K": 64,
        "SCHEDULER": 0,
        "SPLITK": 2,
        "num_warps": 4,
        "num_ctas": 1,
        "num_stages": 1
    },
    "69": {
        "BLOCK_SIZE_M": 128,
        "BLOCK_SIZE_N": 64,
        "BLOCK_SIZE_K": 64,
        "SCHEDULER": 0,
        "SPLITK": 2,
        "num_warps": 4,
        "num_ctas": 1,
        "num_stages": 1
    },
    "70": {
        "BLOCK_SIZE_M": 128,
        "BLOCK_SIZE_N": 64,
        "BLOCK_SIZE_K": 64,
        "SCHEDULER": 0,
        "SPLITK": 2,
        "num_warps": 4,
        "num_ctas": 1,
        "num_stages": 1
    },
    "71": {
        "BLOCK_SIZE_M": 128,
        "BLOCK_SIZE_N": 64,
        "BLOCK_SIZE_K": 64,
        "SCHEDULER": 0,
        "SPLITK": 2,
        "num_warps": 4,
        "num_ctas": 1,
        "num_stages": 1
    },
    "72": {
        "BLOCK_SIZE_M": 128,
        "BLOCK_SIZE_N": 64,
        "BLOCK_SIZE_K": 64,
        "SCHEDULER": 0,
        "SPLITK": 2,
        "num_warps": 4,
        "num_ctas": 1,
        "num_stages": 1
    },
    "73": {
        "BLOCK_SIZE_M": 128,
        "BLOCK_SIZE_N": 64,
        "BLOCK_SIZE_K": 64,
        "SCHEDULER": 0,
        "SPLITK": 2,
        "num_warps": 4,
        "num_ctas": 1,
        "num_stages": 1
    },
    "74": {
        "BLOCK_SIZE_M": 128,
        "BLOCK_SIZE_N": 64,
        "BLOCK_SIZE_K": 64,
        "SCHEDULER": 0,
        "SPLITK": 2,
        "num_warps": 4,
        "num_ctas": 1,
        "num_stages": 1
    },
    "75": {
        "BLOCK_SIZE_M": 128,
        "BLOCK_SIZE_N": 64,
        "BLOCK_SIZE_K": 64,
        "SCHEDULER": 0,
        "SPLITK": 2,
        "num_warps": 4,
        "num_ctas": 1,
        "num_stages": 1
    },
    "76": {
        "BLOCK_SIZE_M": 128,
        "BLOCK_SIZE_N": 64,
        "BLOCK_SIZE_K": 64,
        "SCHEDULER": 0,
        "SPLITK": 2,
        "num_warps": 4,
        "num_ctas": 1,
        "num_stages": 1
    },
    "77": {
        "BLOCK_SIZE_M": 128,
        "BLOCK_SIZE_N": 64,
        "BLOCK_SIZE_K": 64,
        "SCHEDULER": 0,
        "SPLITK": 2,
        "num_warps": 4,
        "num_ctas": 1,
        "num_stages": 1
    },
    "78": {
        "BLOCK_SIZE_M": 128,
        "BLOCK_SIZE_N": 64,
        "BLOCK_SIZE_K": 64,
        "SCHEDULER": 0,
        "SPLITK": 2,
        "num_warps": 4,
        "num_ctas": 1,
        "num_stages": 1
    },
    "79": {
        "BLOCK_SIZE_M": 128,
        "BLOCK_SIZE_N": 64,
        "BLOCK_SIZE_K": 64,
        "SCHEDULER": 0,
        "SPLITK": 2,
        "num_warps": 4,
        "num_ctas": 1,
        "num_stages": 1
    },
    "80": {
        "BLOCK_SIZE_M": 128,
        "BLOCK_SIZE_N": 64,
        "BLOCK_SIZE_K": 64,
        "SCHEDULER": 0,
        "SPLITK": 2,
        "num_warps": 4,
        "num_ctas": 1,
        "num_stages": 1
    },
    "81": {
        "BLOCK_SIZE_M": 128,
        "BLOCK_SIZE_N": 64,
        "BLOCK_SIZE_K": 64,
        "SCHEDULER": 0,
        "SPLITK": 2,
        "num_warps": 4,
        "num_ctas": 1,
        "num_stages": 1
    },
    "82": {
        "BLOCK_SIZE_M": 128,
        "BLOCK_SIZE_N": 64,
        "BLOCK_SIZE_K": 64,
        "SCHEDULER": 0,
        "SPLITK": 2,
        "num_warps": 4,
        "num_ctas": 1,
        "num_stages": 1
    },
    "83": {
        "BLOCK_SIZE_M": 128,
        "BLOCK_SIZE_N": 64,
        "BLOCK_SIZE_K": 64,
        "SCHEDULER": 0,
        "SPLITK": 2,
        "num_warps": 4,
        "num_ctas": 1,
        "num_stages": 1
    },
    "84": {
        "BLOCK_SIZE_M": 128,
        "BLOCK_SIZE_N": 64,
        "BLOCK_SIZE_K": 64,
        "SCHEDULER": 0,
        "SPLITK": 2,
        "num_warps": 4,
        "num_ctas": 1,
        "num_stages": 1
    },
    "85": {
        "BLOCK_SIZE_M": 128,
        "BLOCK_SIZE_N": 64,
        "BLOCK_SIZE_K": 64,
        "SCHEDULER": 0,
        "SPLITK": 2,
        "num_warps": 4,
        "num_ctas": 1,
        "num_stages": 1
    },
    "86": {
        "BLOCK_SIZE_M": 128,
        "BLOCK_SIZE_N": 64,
        "BLOCK_SIZE_K": 64,
        "SCHEDULER": 0,
        "SPLITK": 2,
        "num_warps": 4,
        "num_ctas": 1,
        "num_stages": 1
    },
    "87": {
        "BLOCK_SIZE_M": 128,
        "BLOCK_SIZE_N": 64,
        "BLOCK_SIZE_K": 64,
        "SCHEDULER": 0,
        "SPLITK": 2,
        "num_warps": 4,
        "num_ctas": 1,
        "num_stages": 1
    },
    "88": {
        "BLOCK_SIZE_M": 128,
        "BLOCK_SIZE_N": 64,
        "BLOCK_SIZE_K": 64,
        "SCHEDULER": 0,
        "SPLITK": 2,
        "num_warps": 4,
        "num_ctas": 1,
        "num_stages": 1
    },
    "89": {
        "BLOCK_SIZE_M": 128,
        "BLOCK_SIZE_N": 64,
        "BLOCK_SIZE_K": 64,
        "SCHEDULER": 1,
        "SPLITK": 1,
        "num_warps": 8,
        "num_ctas": 1,
        "num_stages": 2
    },
    "90": {
        "BLOCK_SIZE_M": 128,
        "BLOCK_SIZE_N": 64,
        "BLOCK_SIZE_K": 64,
        "SCHEDULER": 1,
        "SPLITK": 1,
        "num_warps": 8,
        "num_ctas": 1,
        "num_stages": 2
    },
    "91": {
        "BLOCK_SIZE_M": 128,
        "BLOCK_SIZE_N": 64,
        "BLOCK_SIZE_K": 64,
        "SCHEDULER": 1,
        "SPLITK": 1,
        "num_warps": 8,
        "num_ctas": 1,
        "num_stages": 2
    },
    "92": {
        "BLOCK_SIZE_M": 128,
        "BLOCK_SIZE_N": 64,
        "BLOCK_SIZE_K": 64,
        "SCHEDULER": 1,
        "SPLITK": 1,
        "num_warps": 8,
        "num_ctas": 1,
        "num_stages": 2
    },
    "93": {
        "BLOCK_SIZE_M": 128,
        "BLOCK_SIZE_N": 64,
        "BLOCK_SIZE_K": 64,
        "SCHEDULER": 1,
        "SPLITK": 1,
        "num_warps": 8,
        "num_ctas": 1,
        "num_stages": 2
    },
    "94": {
        "BLOCK_SIZE_M": 128,
        "BLOCK_SIZE_N": 64,
        "BLOCK_SIZE_K": 64,
        "SCHEDULER": 1,
        "SPLITK": 1,
        "num_warps": 8,
        "num_ctas": 1,
        "num_stages": 2
    },
    "95": {
        "BLOCK_SIZE_M": 128,
        "BLOCK_SIZE_N": 64,
        "BLOCK_SIZE_K": 64,
        "SCHEDULER": 1,
        "SPLITK": 1,
        "num_warps": 8,
        "num_ctas": 1,
        "num_stages": 2
    },
    "96": {
        "BLOCK_SIZE_M": 128,
        "BLOCK_SIZE_N": 64,
        "BLOCK_SIZE_K": 64,
        "SCHEDULER": 1,
        "SPLITK": 1,
        "num_warps": 8,
        "num_ctas": 1,
        "num_stages": 2
    },
    "97": {
        "BLOCK_SIZE_M": 128,
        "BLOCK_SIZE_N": 64,
        "BLOCK_SIZE_K": 64,
        "SCHEDULER": 0,
        "SPLITK": 2,
        "num_warps": 4,
        "num_ctas": 1,
        "num_stages": 1
    },
    "98": {
        "BLOCK_SIZE_M": 128,
        "BLOCK_SIZE_N": 64,
        "BLOCK_SIZE_K": 64,
        "SCHEDULER": 0,
        "SPLITK": 2,
        "num_warps": 4,
        "num_ctas": 1,
        "num_stages": 1
    },
    "99": {
        "BLOCK_SIZE_M": 128,
        "BLOCK_SIZE_N": 64,
        "BLOCK_SIZE_K": 64,
        "SCHEDULER": 0,
        "SPLITK": 2,
        "num_warps": 4,
        "num_ctas": 1,
        "num_stages": 1
    },
    "100": {
        "BLOCK_SIZE_M": 128,
        "BLOCK_SIZE_N": 64,
        "BLOCK_SIZE_K": 64,
        "SCHEDULER": 0,
        "SPLITK": 2,
        "num_warps": 4,
        "num_ctas": 1,
        "num_stages": 1
    },
    "101": {
        "BLOCK_SIZE_M": 128,
        "BLOCK_SIZE_N": 64,
        "BLOCK_SIZE_K": 64,
        "SCHEDULER": 0,
        "SPLITK": 2,
        "num_warps": 4,
        "num_ctas": 1,
        "num_stages": 1
    },
    "102": {
        "BLOCK_SIZE_M": 128,
        "BLOCK_SIZE_N": 64,
        "BLOCK_SIZE_K": 64,
        "SCHEDULER": 0,
        "SPLITK": 2,
        "num_warps": 4,
        "num_ctas": 1,
        "num_stages": 1
    },
    "103": {
        "BLOCK_SIZE_M": 128,
        "BLOCK_SIZE_N": 64,
        "BLOCK_SIZE_K": 64,
        "SCHEDULER": 0,
        "SPLITK": 2,
        "num_warps": 4,
        "num_ctas": 1,
        "num_stages": 1
    },
    "104": {
        "BLOCK_SIZE_M": 128,
        "BLOCK_SIZE_N": 64,
        "BLOCK_SIZE_K": 64,
        "SCHEDULER": 1,
        "SPLITK": 1,
        "num_warps": 8,
        "num_ctas": 1,
        "num_stages": 2
    },
    "105": {
        "BLOCK_SIZE_M": 128,
        "BLOCK_SIZE_N": 64,
        "BLOCK_SIZE_K": 64,
        "SCHEDULER": 0,
        "SPLITK": 2,
        "num_warps": 4,
        "num_ctas": 1,
        "num_stages": 1
    },
    "106": {
        "BLOCK_SIZE_M": 128,
        "BLOCK_SIZE_N": 64,
        "BLOCK_SIZE_K": 64,
        "SCHEDULER": 0,
        "SPLITK": 2,
        "num_warps": 4,
        "num_ctas": 1,
        "num_stages": 1
    },
    "107": {
        "BLOCK_SIZE_M": 128,
        "BLOCK_SIZE_N": 64,
        "BLOCK_SIZE_K": 64,
        "SCHEDULER": 0,
        "SPLITK": 2,
        "num_warps": 4,
        "num_ctas": 1,
        "num_stages": 1
    },
    "108": {
        "BLOCK_SIZE_M": 128,
        "BLOCK_SIZE_N": 64,
        "BLOCK_SIZE_K": 64,
        "SCHEDULER": 0,
        "SPLITK": 2,
        "num_warps": 4,
        "num_ctas": 1,
        "num_stages": 1
    },
    "109": {
        "BLOCK_SIZE_M": 128,
        "BLOCK_SIZE_N": 64,
        "BLOCK_SIZE_K": 64,
        "SCHEDULER": 0,
        "SPLITK": 2,
        "num_warps": 4,
        "num_ctas": 1,
        "num_stages": 1
    },
    "110": {
        "BLOCK_SIZE_M": 128,
        "BLOCK_SIZE_N": 64,
        "BLOCK_SIZE_K": 64,
        "SCHEDULER": 0,
        "SPLITK": 2,
        "num_warps": 4,
        "num_ctas": 1,
        "num_stages": 1
    },
    "111": {
        "BLOCK_SIZE_M": 128,
        "BLOCK_SIZE_N": 64,
        "BLOCK_SIZE_K": 64,
        "SCHEDULER": 0,
        "SPLITK": 2,
        "num_warps": 4,
        "num_ctas": 1,
        "num_stages": 1
    },
    "112": {
        "BLOCK_SIZE_M": 128,
        "BLOCK_SIZE_N": 64,
        "BLOCK_SIZE_K": 64,
        "SCHEDULER": 0,
        "SPLITK": 2,
        "num_warps": 4,
        "num_ctas": 1,
        "num_stages": 1
    },
    "113": {
        "BLOCK_SIZE_M": 128,
        "BLOCK_SIZE_N": 64,
        "BLOCK_SIZE_K": 64,
        "SCHEDULER": 1,
        "SPLITK": 1,
        "num_warps": 8,
        "num_ctas": 1,
        "num_stages": 2
    },
    "114": {
        "BLOCK_SIZE_M": 128,
        "BLOCK_SIZE_N": 64,
        "BLOCK_SIZE_K": 64,
        "SCHEDULER": 1,
        "SPLITK": 1,
        "num_warps": 8,
        "num_ctas": 1,
        "num_stages": 2
    },
    "115": {
        "BLOCK_SIZE_M": 128,
        "BLOCK_SIZE_N": 64,
        "BLOCK_SIZE_K": 64,
        "SCHEDULER": 1,
        "SPLITK": 1,
        "num_warps": 8,
        "num_ctas": 1,
        "num_stages": 2
    },
    "116": {
        "BLOCK_SIZE_M": 128,
        "BLOCK_SIZE_N": 64,
        "BLOCK_SIZE_K": 64,
        "SCHEDULER": 1,
        "SPLITK": 1,
        "num_warps": 8,
        "num_ctas": 1,
        "num_stages": 2
    },
    "117": {
        "BLOCK_SIZE_M": 128,
        "BLOCK_SIZE_N": 64,
        "BLOCK_SIZE_K": 64,
        "SCHEDULER": 1,
        "SPLITK": 1,
        "num_warps": 8,
        "num_ctas": 1,
        "num_stages": 2
    },
    "118": {
        "BLOCK_SIZE_M": 128,
        "BLOCK_SIZE_N": 64,
        "BLOCK_SIZE_K": 64,
        "SCHEDULER": 1,
        "SPLITK": 1,
        "num_warps": 8,
        "num_ctas": 1,
        "num_stages": 2
    },
    "119": {
        "BLOCK_SIZE_M": 128,
        "BLOCK_SIZE_N": 64,
        "BLOCK_SIZE_K": 64,
        "SCHEDULER": 0,
        "SPLITK": 2,
        "num_warps": 8,
        "num_ctas": 1,
        "num_stages": 1
    },
    "120": {
        "BLOCK_SIZE_M": 128,
        "BLOCK_SIZE_N": 64,
        "BLOCK_SIZE_K": 64,
        "SCHEDULER": 0,
        "SPLITK": 2,
        "num_warps": 8,
        "num_ctas": 1,
        "num_stages": 1
    },
    "121": {
        "BLOCK_SIZE_M": 128,
        "BLOCK_SIZE_N": 64,
        "BLOCK_SIZE_K": 64,
        "SCHEDULER": 1,
        "SPLITK": 1,
        "num_warps": 8,
        "num_ctas": 1,
        "num_stages": 2
    },
    "122": {
        "BLOCK_SIZE_M": 128,
        "BLOCK_SIZE_N": 64,
        "BLOCK_SIZE_K": 64,
        "SCHEDULER": 0,
        "SPLITK": 2,
        "num_warps": 8,
        "num_ctas": 1,
        "num_stages": 1
    },
    "123": {
        "BLOCK_SIZE_M": 128,
        "BLOCK_SIZE_N": 64,
        "BLOCK_SIZE_K": 64,
        "SCHEDULER": 0,
        "SPLITK": 2,
        "num_warps": 8,
        "num_ctas": 1,
        "num_stages": 1
    },
    "124": {
        "BLOCK_SIZE_M": 128,
        "BLOCK_SIZE_N": 64,
        "BLOCK_SIZE_K": 64,
        "SCHEDULER": 0,
        "SPLITK": 2,
        "num_warps": 8,
        "num_ctas": 1,
        "num_stages": 1
    },
    "125": {
        "BLOCK_SIZE_M": 128,
        "BLOCK_SIZE_N": 64,
        "BLOCK_SIZE_K": 64,
        "SCHEDULER": 0,
        "SPLITK": 2,
        "num_warps": 8,
        "num_ctas": 1,
        "num_stages": 1
    },
    "126": {
        "BLOCK_SIZE_M": 128,
        "BLOCK_SIZE_N": 64,
        "BLOCK_SIZE_K": 64,
        "SCHEDULER": 0,
        "SPLITK": 2,
        "num_warps": 8,
        "num_ctas": 1,
        "num_stages": 1
    },
    "127": {
        "BLOCK_SIZE_M": 64,
        "BLOCK_SIZE_N": 32,
        "BLOCK_SIZE_K": 64,
        "SCHEDULER": 1,
        "SPLITK": 1,
        "num_warps": 4,
        "num_ctas": 1,
        "num_stages": 1
    },
    "128": {
        "BLOCK_SIZE_M": 128,
        "BLOCK_SIZE_N": 64,
        "BLOCK_SIZE_K": 64,
        "SCHEDULER": 0,
        "SPLITK": 2,
        "num_warps": 8,
        "num_ctas": 1,
        "num_stages": 1
    }
}