3rdparty/vllm/model_executor/layers/quantization/utils/configs/N=256,K=7168,device_name=K100_AI,dtype=int8_w8a8,block_shape=[128, 128].json
{
    "1": {
        "BLOCK_SIZE_M": 32,
        "BLOCK_SIZE_N": 16,
        "BLOCK_SIZE_K": 128,
        "GROUP_SIZE_M": 128,
        "num_warps": 2,
        "num_stages": 2,
        "COMBINE_SCALE_LOAD": 0
    },
    "2": {
        "BLOCK_SIZE_M": 16,
        "BLOCK_SIZE_N": 16,
        "BLOCK_SIZE_K": 128,
        "GROUP_SIZE_M": 64,
        "num_warps": 2,
        "num_stages": 2,
        "COMBINE_SCALE_LOAD": 0
    },
    "4": {
        "BLOCK_SIZE_M": 16,
        "BLOCK_SIZE_N": 16,
        "BLOCK_SIZE_K": 128,
        "GROUP_SIZE_M": 64,
        "num_warps": 2,
        "num_stages": 2,
        "COMBINE_SCALE_LOAD": 0
    },
    "6": {
        "BLOCK_SIZE_M": 16,
        "BLOCK_SIZE_N": 16,
        "BLOCK_SIZE_K": 128,
        "GROUP_SIZE_M": 128,
        "num_warps": 1,
        "num_stages": 2,
        "COMBINE_SCALE_LOAD": 0
    },
    "8": {
        "BLOCK_SIZE_M": 16,
        "BLOCK_SIZE_N": 16,
        "BLOCK_SIZE_K": 128,
        "GROUP_SIZE_M": 32,
        "num_warps": 2,
        "num_stages": 2,
        "COMBINE_SCALE_LOAD": 0
    },
    "16": {
        "BLOCK_SIZE_M": 16,
        "BLOCK_SIZE_N": 16,
        "BLOCK_SIZE_K": 128,
        "GROUP_SIZE_M": 64,
        "num_warps": 1,
        "num_stages": 2,
        "COMBINE_SCALE_LOAD": 0
    },
    "23": {
        "BLOCK_SIZE_M": 16,
        "BLOCK_SIZE_N": 16,
        "BLOCK_SIZE_K": 128,
        "GROUP_SIZE_M": 128,
        "num_warps": 1,
        "num_stages": 2,
        "COMBINE_SCALE_LOAD": 0
    },
    "32": {
        "BLOCK_SIZE_M": 16,
        "BLOCK_SIZE_N": 16,
        "BLOCK_SIZE_K": 128,
        "GROUP_SIZE_M": 32,
        "num_warps": 1,
        "num_stages": 2,
        "COMBINE_SCALE_LOAD": 0
    },
    "64": {
        "BLOCK_SIZE_M": 16,
        "BLOCK_SIZE_N": 16,
        "BLOCK_SIZE_K": 128,
        "GROUP_SIZE_M": 64,
        "num_warps": 2,
        "num_stages": 2,
        "COMBINE_SCALE_LOAD": 0
    },
    "127": {
        "BLOCK_SIZE_M": 32,
        "BLOCK_SIZE_N": 32,
        "BLOCK_SIZE_K": 128,
        "GROUP_SIZE_M": 128,
        "num_warps": 4,
        "num_stages": 2,
        "COMBINE_SCALE_LOAD": 0
    },
    "128": {
        "BLOCK_SIZE_M": 32,
        "BLOCK_SIZE_N": 32,
        "BLOCK_SIZE_K": 128,
        "GROUP_SIZE_M": 64,
        "num_warps": 4,
        "num_stages": 2,
        "COMBINE_SCALE_LOAD": 0
    },
    "172": {
        "BLOCK_SIZE_M": 16,
        "BLOCK_SIZE_N": 16,
        "BLOCK_SIZE_K": 128,
        "GROUP_SIZE_M": 32,
        "num_warps": 2,
        "num_stages": 2,
        "COMBINE_SCALE_LOAD": 0
    },
    "256": {
        "BLOCK_SIZE_M": 32,
        "BLOCK_SIZE_N": 32,
        "BLOCK_SIZE_K": 128,
        "GROUP_SIZE_M": 64,
        "num_warps": 4,
        "num_stages": 2,
        "COMBINE_SCALE_LOAD": 0
    },
    "512": {
        "BLOCK_SIZE_M": 32,
        "BLOCK_SIZE_N": 64,
        "BLOCK_SIZE_K": 128,
        "GROUP_SIZE_M": 128,
        "num_warps": 8,
        "num_stages": 2,
        "COMBINE_SCALE_LOAD": 0
    },
    "1024": {
        "BLOCK_SIZE_M": 32,
        "BLOCK_SIZE_N": 32,
        "BLOCK_SIZE_K": 128,
        "GROUP_SIZE_M": 128,
        "num_warps": 2,
        "num_stages": 2,
        "COMBINE_SCALE_LOAD": 0
    },
    "1536": {
        "BLOCK_SIZE_M": 32,
        "BLOCK_SIZE_N": 64,
        "BLOCK_SIZE_K": 128,
        "GROUP_SIZE_M": 128,
        "num_warps": 4,
        "num_stages": 2,
        "COMBINE_SCALE_LOAD": 0
    },
    "2048": {
        "BLOCK_SIZE_M": 32,
        "BLOCK_SIZE_N": 64,
        "BLOCK_SIZE_K": 128,
        "GROUP_SIZE_M": 128,
        "num_warps": 2,
        "num_stages": 1,
        "COMBINE_SCALE_LOAD": 1
    },
    "2879": {
        "BLOCK_SIZE_M": 64,
        "BLOCK_SIZE_N": 64,
        "BLOCK_SIZE_K": 128,
        "GROUP_SIZE_M": 128,
        "num_warps": 4,
        "num_stages": 1,
        "COMBINE_SCALE_LOAD": 0
    },
    "4096": {
        "BLOCK_SIZE_M": 64,
        "BLOCK_SIZE_N": 64,
        "BLOCK_SIZE_K": 128,
        "GROUP_SIZE_M": 32,
        "num_warps": 2,
        "num_stages": 1,
        "COMBINE_SCALE_LOAD": 1
    },
    "8192": {
        "BLOCK_SIZE_M": 64,
        "BLOCK_SIZE_N": 128,
        "BLOCK_SIZE_K": 128,
        "GROUP_SIZE_M": 32,
        "num_warps": 4,
        "num_stages": 1,
        "COMBINE_SCALE_LOAD": 1
    },
    "16384": {
        "BLOCK_SIZE_M": 64,
        "BLOCK_SIZE_N": 128,
        "BLOCK_SIZE_K": 128,
        "GROUP_SIZE_M": 32,
        "num_warps": 4,
        "num_stages": 1,
        "COMBINE_SCALE_LOAD": 1
    }
}