3rdparty/vllm/model_executor/layers/quantization/utils/configs/N=7168,K=256,device_name=BW200,dtype=int8_w8a8,block_shape=[128, 128].json
{
    "1": {
        "BLOCK_SIZE_M": 16,
        "BLOCK_SIZE_N": 16,
        "BLOCK_SIZE_K": 128,
        "GROUP_SIZE_M": 64,
        "COMBINE_SCALE_LOAD": false,
        "num_warps": 1,
        "num_ctas": 1,
        "num_stages": 2
    },
    "2": {
        "BLOCK_SIZE_M": 16,
        "BLOCK_SIZE_N": 32,
        "BLOCK_SIZE_K": 128,
        "GROUP_SIZE_M": 32,
        "COMBINE_SCALE_LOAD": false,
        "num_warps": 2,
        "num_ctas": 1,
        "num_stages": 2
    },
    "4": {
        "BLOCK_SIZE_M": 16,
        "BLOCK_SIZE_N": 32,
        "BLOCK_SIZE_K": 128,
        "GROUP_SIZE_M": 32,
        "COMBINE_SCALE_LOAD": false,
        "num_warps": 2,
        "num_ctas": 1,
        "num_stages": 2
    },
    "8": {
        "BLOCK_SIZE_M": 16,
        "BLOCK_SIZE_N": 32,
        "BLOCK_SIZE_K": 128,
        "GROUP_SIZE_M": 32,
        "COMBINE_SCALE_LOAD": false,
        "num_warps": 2,
        "num_ctas": 1,
        "num_stages": 2
    },
    "16": {
        "BLOCK_SIZE_M": 16,
        "BLOCK_SIZE_N": 32,
        "BLOCK_SIZE_K": 128,
        "GROUP_SIZE_M": 64,
        "COMBINE_SCALE_LOAD": false,
        "num_warps": 2,
        "num_ctas": 1,
        "num_stages": 2
    },
    "32": {
        "BLOCK_SIZE_M": 32,
        "BLOCK_SIZE_N": 64,
        "BLOCK_SIZE_K": 128,
        "GROUP_SIZE_M": 32,
        "COMBINE_SCALE_LOAD": false,
        "num_warps": 4,
        "num_ctas": 1,
        "num_stages": 2
    },
    "64": {
        "BLOCK_SIZE_M": 64,
        "BLOCK_SIZE_N": 64,
        "BLOCK_SIZE_K": 128,
        "GROUP_SIZE_M": 32,
        "COMBINE_SCALE_LOAD": true,
        "num_warps": 4,
        "num_ctas": 1,
        "num_stages": 1
    },
    "128": {
        "BLOCK_SIZE_M": 64,
        "BLOCK_SIZE_N": 64,
        "BLOCK_SIZE_K": 128,
        "GROUP_SIZE_M": 32,
        "COMBINE_SCALE_LOAD": true,
        "num_warps": 4,
        "num_ctas": 1,
        "num_stages": 1
    },
    "256": {
        "BLOCK_SIZE_M": 128,
        "BLOCK_SIZE_N": 64,
        "BLOCK_SIZE_K": 128,
        "GROUP_SIZE_M": 64,
        "COMBINE_SCALE_LOAD": true,
        "num_warps": 4,
        "num_ctas": 1,
        "num_stages": 1
    },
    "512": {
        "BLOCK_SIZE_M": 128,
        "BLOCK_SIZE_N": 64,
        "BLOCK_SIZE_K": 128,
        "GROUP_SIZE_M": 64,
        "COMBINE_SCALE_LOAD": true,
        "num_warps": 4,
        "num_ctas": 1,
        "num_stages": 1
    },
    "1024": {
        "BLOCK_SIZE_M": 64,
        "BLOCK_SIZE_N": 256,
        "BLOCK_SIZE_K": 128,
        "GROUP_SIZE_M": 64,
        "COMBINE_SCALE_LOAD": false,
        "num_warps": 4,
        "num_ctas": 1,
        "num_stages": 1
    },
    "2048": {
        "BLOCK_SIZE_M": 128,
        "BLOCK_SIZE_N": 128,
        "BLOCK_SIZE_K": 128,
        "GROUP_SIZE_M": 32,
        "COMBINE_SCALE_LOAD": true,
        "num_warps": 4,
        "num_ctas": 1,
        "num_stages": 1
    },
    "4096": {
        "BLOCK_SIZE_M": 128,
        "BLOCK_SIZE_N": 128,
        "BLOCK_SIZE_K": 128,
        "GROUP_SIZE_M": 32,
        "COMBINE_SCALE_LOAD": true,
        "num_warps": 4,
        "num_ctas": 1,
        "num_stages": 1
    },
    "8192": {
        "BLOCK_SIZE_M": 128,
        "BLOCK_SIZE_N": 128,
        "BLOCK_SIZE_K": 128,
        "GROUP_SIZE_M": 32,
        "COMBINE_SCALE_LOAD": true,
        "num_warps": 4,
        "num_ctas": 1,
        "num_stages": 1
    },
    "16384": {
        "BLOCK_SIZE_M": 128,
        "BLOCK_SIZE_N": 128,
        "BLOCK_SIZE_K": 128,
        "GROUP_SIZE_M": 32,
        "COMBINE_SCALE_LOAD": true,
        "num_warps": 4,
        "num_ctas": 1,
        "num_stages": 1
    },
    "32768": {
        "BLOCK_SIZE_M": 128,
        "BLOCK_SIZE_N": 128,
        "BLOCK_SIZE_K": 128,
        "GROUP_SIZE_M": 32,
        "COMBINE_SCALE_LOAD": true,
        "num_warps": 4,
        "num_ctas": 1,
        "num_stages": 1
    }
}