3rdparty/vllm/model_executor/layers/fused_moe/configs/E=128,N=192,device_name=BW200.json
{
    "1": {
        "BLOCK_SIZE_M": 16,
        "BLOCK_SIZE_N": 16,
        "BLOCK_SIZE_K": 128,
        "GROUP_SIZE_M": 4,
        "COMBINE_SCALE_LOAD": false,
        "instruction_sched_variant": "none",
        "sched_latency": "none",
        "kpack": 2,
        "num_warps": 2,
        "num_stages": 2
    },
    "2": {
        "BLOCK_SIZE_M": 16,
        "BLOCK_SIZE_N": 16,
        "BLOCK_SIZE_K": 128,
        "GROUP_SIZE_M": 4,
        "COMBINE_SCALE_LOAD": false,
        "instruction_sched_variant": "none",
        "sched_latency": "mmac5-ds10",
        "kpack": 2,
        "num_warps": 2,
        "num_stages": 2
    },
    "4": {
        "BLOCK_SIZE_M": 16,
        "BLOCK_SIZE_N": 32,
        "BLOCK_SIZE_K": 128,
        "GROUP_SIZE_M": 4,
        "COMBINE_SCALE_LOAD": false,
        "instruction_sched_variant": "none",
        "sched_latency": "none",
        "kpack": 2,
        "num_warps": 2,
        "num_stages": 1
    },
    "8": {
        "BLOCK_SIZE_M": 16,
        "BLOCK_SIZE_N": 64,
        "BLOCK_SIZE_K": 128,
        "GROUP_SIZE_M": 4,
        "COMBINE_SCALE_LOAD": false,
        "instruction_sched_variant": "none",
        "sched_latency": "mmac5-ds10",
        "kpack": 2,
        "num_warps": 2,
        "num_stages": 3
    },
    "16": {
        "BLOCK_SIZE_M": 16,
        "BLOCK_SIZE_N": 32,
        "BLOCK_SIZE_K": 256,
        "GROUP_SIZE_M": 4,
        "COMBINE_SCALE_LOAD": false,
        "instruction_sched_variant": "none",
        "sched_latency": "none",
        "kpack": 2,
        "num_warps": 2,
        "num_stages": 3
    },
    "24": {
        "BLOCK_SIZE_M": 16,
        "BLOCK_SIZE_N": 64,
        "BLOCK_SIZE_K": 128,
        "GROUP_SIZE_M": 4,
        "COMBINE_SCALE_LOAD": false,
        "instruction_sched_variant": "none",
        "sched_latency": "none",
        "kpack": 2,
        "num_warps": 2,
        "num_stages": 3
    },
    "32": {
        "BLOCK_SIZE_M": 16,
        "BLOCK_SIZE_N": 16,
        "BLOCK_SIZE_K": 256,
        "GROUP_SIZE_M": 1,
        "COMBINE_SCALE_LOAD": false,
        "instruction_sched_variant": "local-prefetch",
        "sched_latency": "mmac5-ds10",
        "kpack": 2,
        "num_warps": 2,
        "num_stages": 2
    },
    "64": {
        "BLOCK_SIZE_M": 16,
        "BLOCK_SIZE_N": 64,
        "BLOCK_SIZE_K": 128,
        "GROUP_SIZE_M": 1,
        "COMBINE_SCALE_LOAD": false,
        "instruction_sched_variant": "none",
        "sched_latency": "none",
        "kpack": 2,
        "num_warps": 4,
        "num_stages": 3
    },
    "128": {
        "BLOCK_SIZE_M": 16,
        "BLOCK_SIZE_N": 64,
        "BLOCK_SIZE_K": 128,
        "GROUP_SIZE_M": 1,
        "COMBINE_SCALE_LOAD": false,
        "instruction_sched_variant": "none",
        "sched_latency": "none",
        "kpack": 1,
        "num_warps": 2,
        "num_stages": 3
    },
    "256": {
        "BLOCK_SIZE_M": 32,
        "BLOCK_SIZE_N": 128,
        "BLOCK_SIZE_K": 128,
        "GROUP_SIZE_M": 4,
        "COMBINE_SCALE_LOAD": false,
        "instruction_sched_variant": "llvm-iglp-1",
        "sched_latency": "mmac5-ds10",
        "kpack": 1,
        "num_warps": 8,
        "num_stages": 2
    },
    "512": {
        "BLOCK_SIZE_M": 64,
        "BLOCK_SIZE_N": 128,
        "BLOCK_SIZE_K": 128,
        "GROUP_SIZE_M": 4,
        "COMBINE_SCALE_LOAD": false,
        "instruction_sched_variant": "llvm-iglp-1",
        "sched_latency": "mmac5-ds10",
        "kpack": 2,
        "num_warps": 4,
        "num_stages": 2
    },
    "1024": {
        "BLOCK_SIZE_M": 128,
        "BLOCK_SIZE_N": 128,
        "BLOCK_SIZE_K": 128,
        "GROUP_SIZE_M": 4,
        "COMBINE_SCALE_LOAD": false,
        "instruction_sched_variant": "llvm-iglp-1",
        "sched_latency": "mmac5-ds10",
        "kpack": 2,
        "num_warps": 8,
        "num_stages": 2
    },
    "2048": {
        "BLOCK_SIZE_M": 128,
        "BLOCK_SIZE_N": 128,
        "BLOCK_SIZE_K": 128,
        "GROUP_SIZE_M": 1,
        "COMBINE_SCALE_LOAD": false,
        "instruction_sched_variant": "none",
        "sched_latency": "none",
        "kpack": 2,
        "num_warps": 8,
        "num_stages": 2
    },
    "4096": {
        "BLOCK_SIZE_M": 128,
        "BLOCK_SIZE_N": 128,
        "BLOCK_SIZE_K": 128,
        "GROUP_SIZE_M": 1,
        "COMBINE_SCALE_LOAD": false,
        "instruction_sched_variant": "none",
        "sched_latency": "mmac5-ds10",
        "kpack": 2,
        "num_warps": 4,
        "num_stages": 1
    },
    "8192": {
        "BLOCK_SIZE_M": 128,
        "BLOCK_SIZE_N": 128,
        "BLOCK_SIZE_K": 128,
        "GROUP_SIZE_M": 1,
        "COMBINE_SCALE_LOAD": false,
        "instruction_sched_variant": "none",
        "sched_latency": "none",
        "kpack": 2,
        "num_warps": 4,
        "num_stages": 1
    },
    "16384": {
        "BLOCK_SIZE_M": 128,
        "BLOCK_SIZE_N": 128,
        "BLOCK_SIZE_K": 128,
        "GROUP_SIZE_M": 1,
        "COMBINE_SCALE_LOAD": false,
        "instruction_sched_variant": "none",
        "sched_latency": "none",
        "kpack": 2,
        "num_warps": 4,
        "num_stages": 1
    },
    "32768": {
        "BLOCK_SIZE_M": 128,
        "BLOCK_SIZE_N": 128,
        "BLOCK_SIZE_K": 128,
        "GROUP_SIZE_M": 1,
        "COMBINE_SCALE_LOAD": false,
        "instruction_sched_variant": "none",
        "sched_latency": "mmac5-ds10",
        "kpack": 2,
        "num_warps": 4,
        "num_stages": 1
    }
}